CNPJ,EMPRESA,CODIGO
05.032.867/0001-42,CAMPASA CAMAROES DO PARA SA,507270
08.848.228/0001-48,CAMPINA GDE AGROMERC SA,501182
08.823.932/0001-46,CAMPINENSE INDUSTRIAS GERAIS SA,4880
04.257.648/0001-07,CAMPO LIMPO AGROPEC SA,507083
23.488.810/0001-34,CAMPO LIMPO AGROPEC SA,514489
11.124.260/0001-95,CAMPO VERDE AGROPEC SA,502685
11.124.260/0001-95,CAMPO VERDE AGROPEC SA,520217
11.577.749/0001-12,CAN CIA AGRI DO NORDESTE,505048
08.092.736/0001-49,CANABRAVA AGROPASTORIL SA,502901
01.533.298/0001-68,CANADENSE SA INDUSTRIA E PNEUS AGRICOLA,2119
22.670.418/0001-49,CANOEIRO AGROPEC SA,500399
09.022.138/0001-66,CANTO DA ITAUEIRA AGROINDL SA,514144
06.866.792/0001-68,CAPEBA-CIA AGROPEC INDL B ALIM,505633
11.671.690/0001-27,CAPEFE-CIA AGROP FAZ ESPLANADA,504491
05.495.452/0001-05,CAPISA-CAROLINA AGRO INDL S A,515701
15.229.110/0001-05,CAPITALE SECURITIZADORA DE CREDITO S.A.,23353
02.591.787/0001-39,CAPITALPART PARTICIPAÇÕES SA,17493
05.398.901/0001-05,CAPRI LOGISTICA S/A,518603
08.642.503/0001-72,CAPRI PARTICIPAÇÕES SA,21296
07.181.704/0001-57,CAPRIBOI CAPRINOS E BOVINOS DO CEARÁ SA,517569
11.450.863/0001-87,CAPRIG CIA AGRI PORTEIRAS RG,503134
06.508.436/0001-72,CAPRINOCULTURA DO PI SA,507768
11.458.643/0001-08,CAPRINOR SA-AGROPEC INDL COML,500518
15.720.212/0001-10,CAPRINOS DA BAHIA SA,500127
15.224.488/0001-08,CARAIBA METAIS SA,13722
04.702.445/0001-74,CARAJAS AGRO FLORESTAL SA,515086
79.119.939/0001-20,CARAMURU ALIMENTOS DE MILHO SA,2127
04.868.980/0001-08,CARANA CIA AGOPAST RIO ANAJAS,507121
04.868.980/0001-08,CARANA CIA AGOPAST RIO ANAJAS,520977
16.998.890/0001-02,CARATINGA AGROPEC SA,503304
28.504.330/0001-33,CARBODERIVADOS SA,502383
07.645.062/0001-08,CARBOMIL QUÍMICA S/A,501131
07.253.321/0001-47,CARBOMIL SA MINER. E INDUSTRIA,14168
17.059.056/0001-14,CARBOVEGETAL SA IND E COM,500666
07.170.657/0001-46,CARCINICULTURA KAMMAROS SA,509558
07.170.657/0001-46,CARCINICULTURA KAMMAROS SA,519421
25.633.934/0001-91,CARFEPE SA - ADMINISTRADORA E PARTICIPADORA,2135
61.156.501/0001-56,CARGILL FERTILIZANTES SA,10863
07.573.058/0001-73,CARIRI INDUSTRIAL DE OLEOS SA,2143
06.714.182/0001-49,CARNAIBAS AGROPEC SA,504203
06.714.182/0001-49,CARNAIBAS AGROPEC SA,519448
07.960.347/0001-25,CAROBA AGROPEC SA,505897
09.146.077/0001-49,CARTAXO AGROPEC SA,504882
22.977.219/0001-88,CARTONBRAS CARTON.DO BRASIL SA,511064
09.306.358/0001-11,CARVPLAST IND COM PLASTICOS SA,517291
61.565.511/0001-45,CASA ANGLO BRASILEIRA S/A,2178
31.468.139/0001-98,CASA DE PEDRA SECURITIZADORA DE CRÉDITO S.A.,24643
92.692.946/0001-84,CASA DICO SA COM E INDUSTRIA,2186
33.024.860/0001-14,CASA JOSE SILVA CONFECCOES SA,2194
92.795.673/0001-01,CASA MASSON SA COM E INDUSTRIA,2208
33.256.918/0001-55,CASAS DA BANHA COMERCIO E INDUSTRIA SA,2216
02.036.214/0001-43,CASCAIS PARTICIPACOES SA,16543
07.092.232/0001-66,CASCAJU AGROINDUSTRIAL SA,13226
12.077.319/0001-02,CASMIG CIA AGRI SAO MIGUEL,514330
28.053.296/0001-28,CASSARO SA IND E COM,510610
10.310.530/0001-90,CASTANHA INDL DO PI SA,504130
41.210.667/0001-04,CASTELO AGRICOLA SA,516627
08.982.647/0001-78,CASTIÇA AGROPECUARIA SA,503851
15.689.185/0001-60,CATA NE SA,501662
14.468.870/0001-02,CAUARUAU AGROPEC SA,512010
06.644.843/0001-07,CAUCAIA AGROPEC SA - CAPISA,500097
07.138.860/0001-35,CAUCAIA INDUSTRIAL SA CAISA,2259
12.350.799/0001-25,CAUIPE AGROINDL SA,514764
09.933.219/0001-18,CAULIM DO NE SA,518956
05.607.122/0001-64,CAUME AGROPASTORIL SA,505170
04.725.925/0001-50,CAVIANA AGROPECUARIA SA,515183
10.742.351/0001-21,CAVISA - CAMPOS VILAR SA,500968
00.027.742/0001-00,CBCC PARTICIPAÇÕES SA,17728
33.053.729/0001-85,CBEI CIA BRASILEIRA ENGENHARIA E INDUSTRIA,2275
60.402.153/0001-97,CBH CIA BRAS HABITACAO,2283
10.939.759/0001-98,CBM CIA BRAS DE EMBALAGENS,509353
14.882.295/0001-81,CBO HOLDING S.A.,23620
09.091.752/0001-80,CBS-CIA BRAS DE SAL REFINADO,501506
15.234.115/0001-18,CBV EQUIPAMENTOS INDS SA,2313
33.051.186/0001-67,CBV INDUSTRIA MECANICA SA,2305
15.213.143/0001-59,CBV NORDESTE IND MECANICA SA,2321
05.836.218/0001-02,CCB - CIA CRIADORA DE BULAFOS,508691
69.720.910/0001-45,CCB BRASIL ARRENDAMENTO MERCANTIL S/A,15121
13.574.736/0001-15,CCB CIA DE CITRICOS DO BRASIL,500135
06.065.247/0001-72,CCC CERAMICA CONSTR E COM SA,503266
15.109.739/0001-03,CCC CIA DE CARBONOS COLOIDAIS,2330
61.345.096/0001-14,CCE IND COM,2348
03.438.637/0001-52,CCO AGROPEC SA,504610
02.846.056/0001-97,CCR S.A.,18821
07.950.674/0001-04,CCX CARVÃO DA COLOMBIA S.A. - EM LIQUIDAÇÃO,20184
62.463.005/0001-08,CEAGESP CIA ENTR ARM GERAIS SP,2356
05.382.742/0001-42,CECAL-CERAMICA CASCAVEL SA,501794
07.174.006/0001-24,CECASA,2496
79.655.916/0001-30,CECRISA REVESTIMENTOS CERAMICOS SA,15610
17.158.536/0001-32,CEESA-CONST.ESTRADAS ESTR. SA,14290
02.201.787/0001-85,CEL PARTICIPAÇÕES S.A. - CELPAR,16675
31.001.230/0001-07,CELEO REDES TRANSMISSÃO DE ENERGIA S.A.,24597
01.543.032/0001-04,CELG DISTRIBUIÇÃO S.A. - CELG D,2445
01.543.032/0001-04,CELG DISTRIBUIÇÃO S.A. - CELG D,25577
61.135.711/0001-68,CELITE SA IND E COMERCIO,2399
61.086.823/0001-76,CELM CIA EQUIP LABS MODERNOS,2402
03.010.016/0001-73,CELULAR CRT PARTICIPAÇÕES S.A.,18210
10.422.699/0001-31,CELULOSE E PAPEL DE PERNAMBUCO S/A,500879
16.129.371/0001-08,CEMA AGROINDL SA,507385
07.844.087/0001-22,CEMAG SA,13013
93.828.986/0001-73,CEMEPE INVESTIMENTOS SA,13854
06.981.180/0001-16,CEMIG DISTRIBUIÇÃO S/A,20303
06.981.176/0001-58,CEMIG GERAÇÃO E TRANSMISSÃO S/A,20320
02.983.428/0001-27,CEMIG TELECOMUNICAÇÕES S/A,18716
11.861.069/0001-26,CEMISA-COQUEIROS CEARA MIRIM,501352
07.949.970/0001-87,CENTENNIAL ASSET PART. MINAS-RIO S/A,20176
08.835.366/0001-92,CENTENNIAL ASSET PARTICIPAÇÕES AÇU SA,21245
34.615.682/0001-69,CENTENO & MOREIRA S/A,511650
04.200.572/0001-75,CENTENOR EMPREEND SA,500526
04.200.572/0001-75,CENTENOR EMPREEND SA,519987
00.001.180/0001-26,CENTRAIS ELETRICAS BRASILEIRAS SA,2437
01.672.223/0001-68,CENTRAIS ELÉTRICAS CACHOEIRA DOURADA S/A,16322
83.878.892/0001-55,CENTRAIS ELETRICAS DE SANTA CATARINA S.A,2461
12.718.011/0001-90,CENTRAL ACUCAR STO ANTONIO SA,505030
04.764.577/0001-20,CENTRAL E. G. R. AJURICABA SA,510351
11.497.229/0001-08,CENTRO AGROPASTORIL RIACHO NAVIO S/A,502146
42.771.949/0001-35,CENTRO DE IMAGEM DIAGNÓSTICOS S.A.,24058
09.866.294/0001-03,CENTRO HOSPITALAR ALBERT SABIN SA,15318
04.645.560/0001-54,CENTRO OTICO DA AMAZONIA SA,505390
02.191.115/0001-36,CENTRO SECULO XXI SA,16640
02.555.926/0001-79,CENTROVIAS-SISTEMAS RODOVIARIOS S/A,21857
61.708.426/0001-99,CEPEBE SA,2470
52.736.840/0001-10,CERAMICA CHIARELLI SA - EM RECUPERAÇÃO JUDICIAL,2488
09.378.316/0001-96,CERAMICA CORDEIRO DO NE SA,502251
08.252.330/0001-86,CERAMICA DE MOSSORO SA CERAMOS,518352
03.266.335/0001-44,CERAMICA JUNCO SA,512109
55.186.423/0001-30,CERAMICA PORTO FERREIRA SA,2500
07.008.253/0001-50,CERAMICA QUEIROZ SA,517771
04.791.307/0001-09,CERAMICA ROSALINO SA,504955
13.034.863/0001-21,CERAMICA SANTA MARCIA SA,2518
13.034.863/0001-21,CERAMICA SANTA MARCIA SA,503096
10.791.218/0001-65,CERAMICA SANTO ANTONIO SA,2526
52.736.790/0001-71,CERAMICA SAO JOSE GUACU,2542
15.104.383/0001-15,CERAMICA SERGIPE SA CERSESA,506010
07.058.951/0001-60,CERAMICA TERRACOTA SA,514683
13.786.785/0001-11,CÉRAMUS BAHIA S.A. - PRODUTOS CERÂMICOS,500909
60.933.603/0001-78,CESP - COMPANHIA ENERGÉTICA DE SÃO PAULO,2577
61.550.497/0001-06,CETENCO ENGENHARIA SA,2585
00.956.274/0001-59,CETERP-CENT TELEF RIB PRETO SA,15288
09.358.105/0001-91,CETIP S.A. - MERCADOS ORGANIZADOS,21792
24.959.199/0001-48,CEVAL CENTRO OESTE S/A,517631
02.189.227/0001-52,CEVAL PARTICIPAÇOES SA,16829
60.586.948/0001-00,CEVEKOL SA IND COM PROD QUIM,2607
25.560.525/0001-02,CHAPADA DA PRATA SA,512915
25.560.525/0001-02,CHAPADA DA PRATA SA,520110
32.476.608/0001-83,CHAPADAO AGRI SA,509094
82.949.371/0001-89,CHAPECO CIA INDL DE ALIMENTOS,12637
77.404.937/0001-57,CHAPECO PARANA SA IND E COM,2615
43.817.154/0001-83,CHASE MANHATTAN LEASING SA A M,8419
12.000.469/0001-00,CHAVES HOT E TUR SA,503290
03.391.520/0001-60,CHEMICAL TRUST S/A,18767
07.450.604/0001-89,CHINA CONSTRUCTION BANK(BRASIL) BANCO MÚLTIPLO S.A.,21113
04.069.035/0001-38,CIA AGREGADOS LEVES DO PARA,509787
07.142.185/0001-18,CIA AGRI DO MA,508772
11.612.348/0001-56,CIA AGRI MATA ESCURA,501212
24.269.912/0001-21,CIA AGRICOLA ARAPUA,512877
24.269.912/0001-21,CIA AGRICOLA ARAPUA,520560
34.814.509/0001-90,CIA AGRICOLA DO ACARA,515760
10.593.804/0001-03,CIA AGRICOLA DO JOHA - CAJA,500577
08.736.225/0001-12,CIA AGRICOLA FAZENDA GALICIA,503444
24.083.305/0001-72,CIA AGRICOLA FORTALEZA,504335
05.872.668/0001-42,CIA AGRICOLA INDUSTRIAL PECUARIA ITATIRA,505358
24.404.394/0001-01,CIA AGRICOLA MASSANGANO,515167
20.564.290/0001-03,CIA AGRICOLA SANTO ANTONIO,502758
08.023.384/0001-70,CIA AGRICOLA SERRA D'AGUA,503860
33.882.507/0001-75,CIA AGRICOLA VALE DO RIO UTINGA,511684
10.049.740/0001-76,CIA AGRICOLA VALE DO ZUTIUA,508624
32.630.733/0001-04,CIA AGRICOLA VOLTA DO RIO,509906
02.194.017/0001-52,CIA AGRO INDL DE GOIAS CAGIGO,2674
06.276.703/0001-23,CIA AGRO PECUARIA SANTA INES,2690
06.731.665/0001-51,CIA AGROINDL ALIM NE CANAAN,503975
09.677.477/0001-80,CIA AGROINDL BOI BRANCO,519880
07.344.047/0001-11,CIA AGROINDL DO NE P/ EXP,504734
32.625.782/0001-40,CIA AGROINDL NOVA ESPERANCA,514438
04.786.448/0001-33,CIA AGROINDL PARAENSE INDUPARA,512265
12.779.856/0001-96,CIA AGROINDL PIRAMBEBA,514578
35.493.527/0001-80,CIA AGROINDL SALINAS SALISA.,515647
07.770.019/0001-66,CIA AGROINDL SAO JOSE,504246
03.198.421/0001-67,CIA AGROPAST MATA DA CHUVA,515337
11.727.112/0001-65,CIA AGROPASTORIL BEIRA RIO,502308
07.315.229/0001-64,CIA AGROPASTORIL DIAMANTE,519138
08.715.492/0001-03,CIA AGROPASTORIL DO CERRADO,508047
11.550.977/0001-07,CIA AGROPASTORIL JACARANDA BA,502960
11.486.255/0001-22,CIA AGROPASTORIL VALE PIRAGIBA,505510
04.939.757/0001-04,CIA AGROPEC AGROSAN,518441
04.201.679/0001-38,CIA AGROPEC AMAPA BUFALO CAPAB,517798
04.619.771/0001-12,CIA AGROPEC CONTINENTAL,504114
05.426.846/0001-01,CIA AGROPEC DO JAHU,519413
08.876.310/0001-86,CIA AGROPEC DO TRIANGULO,520896
11.696.036/0001-78,CIA AGROPEC E INDL S.GONCALO,514519
12.632.915/0001-07,CIA AGROPEC MONTEIRO,512354
09.249.087/0001-00,CIA AGROPEC RANCHARIA - CAPRI,511749
10.411.296/0001-97,CIA AGROPEC SAO FRANCISCO,516899
05.096.755/0001-55,CIA AGROPEC SIMEIRA,500500
04.198.198/0001-10,CIA AGROPEC STA IZABEL,516783
14.351.852/0001-38,CIA AGROPEC SUL DA BAHIA,510459
11.672.086/0001-15,CIA AGROPEC VALE DO BOQUEIRAO,504262
08.635.716/0001-77,CIA AGROPEC VALE DO MUQUEM,504599
08.444.655/0001-60,CIA ALAGOAS INDUSTRIAL-CINAL,508780
11.699.378/0001-41,CIA ALCOOLQUIM NACIONAL,501018
07.292.675/0001-09,CIA ALGIMAR INDUSTRIA QUIMICA ALGINATOS,2704
04.311.536/0001-89,CIA AMAZONENSE AGROINDL,514411
04.306.197/0001-42,CIA AMAZONENSE DE PROD ELETR,503380
04.564.696/0001-30,CIA AMAZONENSE SAPONIFICACAO,2712
33.615.956/0001-57,CIA AMERICA FABRIL,2747
33.074.691/0001-27,CIA AMERICA SUL CFI,2739
22.672.596/0001-09,CIA ATIV RURAIS DO NE - CARNE,508632
33.490.095/0001-28,CIA AUXILIAR EMP MIN CAEMI,2780
06.769.897/0001-07,CIA AVIC DA AM SA - CEAA,504211
08.179.954/0001-15,CIA AVIC STA INES - COASI,501190
41.102.492/0001-03,CIA AVICOLA DO NE CIANE,515965
40.999.856/0001-37,CIA AVICOLA MASSANGANA CIAMA,516970
09.940.024/0001-03,CIA BAHIANA DE CARNES - COBAC.,515272
58.128.174/0001-14,CIA BANDEIRANTES ARMS GERAIS,2810
17.167.362/0001-74,CIA BANDEIRANTES CFI,2801
42.584.128/0001-90,CIA BANGU DESENVOLVIMENTO PARTICIPAÇÕES,2828
06.784.524/0001-05,CIA BOA VISTA DE ALIMENTOS DO NE,519731
42.113.662/0001-18,CIA BOZANO SIMONSEN COM IND,2836
04.787.677/0001-72,CIA BRAS AGROPASTORIL,502260
07.817.893/0001-01,CIA BRAS COMPON DE CALCADOS,505790
02.455.483/0001-44,CIA BRAS DE AGROPEC - COBRAPE,512389
05.099.585/0001-62,CIA BRAS DE ASFALTO AMAZONIA,503541
05.099.585/0001-62,CIA BRAS DE ASFALTO AMAZONIA,520527
10.483.444/0001-89,CIA BRAS DE LATICINIOS,507512
13.029.194/0001-08,CIA BRAS DE POLIURETANO,500046
11.413.150/0001-43,CIA BRAS DE TORRES,500259
33.316.100/0001-80,CIA BRAS MATERIAIS COBRACO,2852
61.079.315/0001-60,CIA BRAS PLASTICOS MONSANTO,2879
61.156.410/0001-10,CIA BRAS PROJETOS OBRAS CBPO,2887
07.203.144/0001-94,CIA BRASILEIRA DE ESTRUTURAS METALICAS,2844
06.298.962/0001-55,CIA CACHUCHA PASTORIL,509299
78.588.415/0001-15,CIA CACIQUE CAFE SOLUVEL,2909
82.508.433/0001-17,CIA CAT. DE ÁGUAS E SANEAMENTO - CASAN,16861
07.275.779/0001-05,CIA CEARA TEXTIL,500291
07.360.506/0001-50,CIA CEARENSE AGROINDL DO CAJU,501980
07.205.719/0001-08,CIA CEARENSE DE CIMEN PORTLAND,516848
33.366.980/0001-08,CIA CERVEJARIA BRAHMA,2917
03.468.832/0001-25,CIA CERVEJARIA CUIABANA,2925
09.934.407/0001-60,CIA CIMENTO ATOL,2976
60.869.302/0001-22,CIA CIMENTO IPANEMA,2992
89.724.017/0001-03,CIA CIMENTO PORTL GAUCHO,3000
33.160.318/0001-99,CIA CIMENTO PORTL PARAISO,3018
15.218.084/0001-01,CIA CIMENTO SALVADOR,3026
61.422.663/0001-99,CIA COMERCIAL BORBA CAMPO,2941
82.636.887/0001-73,CIA COML SCHRADER,2950
33.034.901/0001-53,CIA CONSTRUTORA PEDERNEIRAS,12491
04.872.883/0001-80,CIA CRIADORA DE PEIXES IRACEMA,514632
04.872.883/0001-80,CIA CRIADORA DE PEIXES IRACEMA,520616
09.123.654/0001-87,CIA DE AGUA E ESGOTO DA PARAIBA,19968
12.542.007/0001-14,CIA DE ALIM DO MARANHÃO - COMASA,510904
04.374.427/0001-00,CIA DE CITRUS DO PARA,505129
11.494.564/0001-44,CIA DE COCOS DO NE - CCN,500593
04.731.519/0001-09,CIA DE DES DO NORTE,507954
04.731.519/0001-09,CIA DE DES DO NORTE,519405
04.050.829/0001-50,CIA DE DES NOVA OLINDA,510475
15.139.629/0001-94,CIA DE ELETRICIDADE DO ESTADO DA BAHIA - COELBA,14524
09.795.659/0001-56,CIA DE LUBRIF DO NE - LUBRINOR,514900
05.635.644/0001-70,CIA DE MECANIZACAO DA AM - CMA,515590
06.258.024/0001-21,CIA DE NAVEGACAO DO NORTE CONAN,518115
09.053.620/0001-63,CIA DE OLEOS VEG DO BRASIL,503932
01.938.783/0001-11,CIA DE PARTICIPAÇÕES ALIANÇA DA BAHIA,18708
04.652.792/0001-30,CIA DE RECUPERAÇÃO SECUNDÁRIA,19240
12.536.082/0001-72,CIA DE SACOS DO MARANHAO,510637
03.631.397/0001-08,CIA DES ARAGUAIA CODEARA,12025
05.770.003/0001-28,CIA DESENVOLVIMENTO AGRO PECUARIA INDUSTRIAL MIN EST PA,3034
24.551.772/0001-80,CIA DO RIO PRETO AQUI COM E EX,515434
84.208.123/0001-02,CIA DOCAS DE IMBITUBA,3174
07.047.251/0001-70,CIA ENERG CEARA - COELCE,14869
17.155.730/0001-64,CIA ENERG MINAS GERAIS - CEMIG,2453
10.835.932/0001-08,CIA ENERGÉTICA DE PERNAMBUCO - CELPE,14362
08.324.196/0001-81,CIA ENERGÉTICA DO RIO GRANDE DO NORTE,18139
02.201.268/0001-17,CIA ENERGETICA MERIDIONAL,16900
04.821.435/0001-58,CIA EQUATORIAL DE MINERACAO,507180
33.352.394/0001-04,CIA ESTADUAL DE ÁGUAS E ESGOTOS - CEDAE,16373
08.467.115/0001-00,CIA ESTADUAL DE DISTRIBUIÇÃO DE ENERGIA ELETRICA,20648
92.715.812/0001-31,CIA ESTADUAL DE GERACAO E TRANSMISSAO DE ENERGIA ELETRICA,3204
10.783.777/0001-23,CIA FABRICA YOLANDA,3220
16.718.231/0001-75,CIA FABRIL MASCARENHAS,3239
18.977.124/0001-97,CIA FERRO BRASILEIRO,3247
33.495.615/0001-95,CIA FERRO E ACO DE VITORIA,506567
15.141.799/0001-03,CIA FERRO LIGAS BAHIA FERBASA,3069
16.933.590/0001-45,CIA FERROLIGAS MG - MINASLIGA,506516
23.116.551/0001-10,CIA FIAÇÃO TECELAGEM PARA MINAS,3255
21.796.032/0001-15,CIA FIACAO TECIDOS CEDRONORTE,500860
08.479.123/0001-69,CIA FRIGORIFICO POTENGY,505650
92.659.325/0001-07,CIA GERAL DE INDUSTRIAS,3280
12.506.192/0001-91,CIA GRAFICA DO NE,507318
82.639.139/0001-44,CIA HERING,3301
78.876.950/0001-71,CIA HERING,14761
33.541.368/0001-16,CIA HIDRO ELÉTRICA DO SÃO FRANCISCO,3328
13.369.475/0001-00,CIA HOTEIS TURISTICOS - COMTUR,506702
33.433.822/0001-15,CIA INDL AGRIC SANTA CECILIA,3433
08.666.091/0001-00,CIA INDL ALIMENTOS DO NORDESTE CIAN,518476
04.384.319/0001-19,CIA INDL AMAZONENSE,3379
13.004.304/0001-79,CIA INDL DE CELULOSE E PAPEL,512133
04.061.693/0001-83,CIA INDL DE LATIC DO ACRE,502600
07.584.279/0001-47,CIA INDL DE LATICINIOS DO CARIRI - CILCA,510769
07.584.279/0001-47,CIA INDL DE LATICINIOS DO CARIRI - CILCA,520411
04.387.734/0001-26,CIA INDL DE MADEIRAS CIM,512192
07.199.490/0001-46,CIA INDL DE OLEOS DO NE,505331
12.924.130/0001-08,CIA INDL DE REVESTIM CERAMICOS,510246
05.379.664/0001-27,CIA INDL DE VIDROS DO CEARA,503150
16.805.251/0001-83,CIA INDL ITAUNENSE DO NE,503312
14.031.868/0001-63,CIA INDL LATICINIOS PARA-CILPA,512591
61.074.506/0001-30,CIA INDL MERC ARTEF FERRO,3468
56.969.355/0001-48,CIA INDL MERC PAOLETTI,3441
07.285.448/0001-48,CIA INDL MICHELETTO,3476
10.775.112/0001-78,CIA INDL MOVEIS PATENTE FAIXA AZUL,518794
92.779.438/0001-38,CIA INDL RIO GUAHYBA,3514
33.174.145/0001-68,CIA INDL SAO PAULO RIO CISPER,3530
07.785.306/0001-40,CIA INDUSTRIAL AGROPECUARIA CONAPE,3360
17.161.316/0001-68,CIA INDUSTRIAL BELO HORIZONTE,3387
07.998.164/0001-07,CIA INDUSTRIAL BRASILEIRA ALIMENTOS,13811
07.998.164/0001-07,CIA INDUSTRIAL BRASILEIRA ALIMENTOS,502880
33.041.120/0001-96,CIA INDUSTRIAL DOX,3344
07.197.411/0001-68,CIA INDUSTRIAL PELES COUROS,3425
19.711.282/0001-63,CIA INDUSTRIAL SANTA MATILDE,3522
82.981.929/0001-03,CIA INDUSTRIAL SCHLOSSER S.A.,3549
06.721.286/0001-80,CIA INTEGR DE MIN CALCINAC PI,507210
01.222.069/0001-22,CIA INTER-ATLANTICO PARTICIPS,15792
42.584.060/0001-49,CIA INTERNACIONAL FIDUCIARIA,3557
04.904.199/0001-33,CIA INVEST DO PARA,3093
00.189.469/0001-10,CIA INVESTS LATINOAMERICANA,14745
92.753.367/0001-02,CIA IOCHPE,3573
69.923.613/0001-05,CIA JOFRA AGRICOLA,517062
60.434.487/0001-42,CIA LECO DE PRODS ALIMENTICIOS,3603
78.597.697/0001-17,CIA LONDRIMALHAS HERINGER INDUSTRIA E COMERCIO,12947
04.971.941/0001-23,CIA MADEIREIRA SAO MIGUEL,3620
09.016.361/0001-09,CIA MARANHENSE DE PROD AGROPEC,501948
09.016.361/0001-09,CIA MARANHENSE DE PROD AGROPEC,519545
12.112.330/0001-58,CIA MARANHENSE DE ROUPAS COMAR,515841
06.272.199/0001-93,CIA MARANHENSE REFRIGERANTES,3638
06.996.185/0001-12,CIA MATOS NOVOS VALE ITAPECURU,512184
22.664.890/0001-79,CIA MATS SULFUROSOS MATSULFUR,3646
28.415.164/0001-07,CIA METALURGICA DO ES,510548
12.536.553/0001-42,CIA METALURGICA DO MA,509639
91.154.690/0001-99,CIA MINUANO DE ALIMENTOS,12246
24.069.916/0001-66,CIA N SRA DAS MASCARENHAS,510947
71.039.119/0001-16,CIA NAC FRIGORIFICOS CONFRIO,3735
33.098.112/0001-86,CIA NACIONAL DE ALCALIS,15555
71.444.582/0001-43,CIA NACIONAL ESTAMPARIA CIANE,3727
33.630.120/0001-21,CIA NAVEGACAO LLOYD BRASILEIRO,3760
61.150.348/0001-50,CIA NITROQUIMICA BRASILEIRA,3778
10.913.796/0001-27,CIA NORDESTINA DE ALIMENTOS - CANORTE,508616
11.008.083/0001-81,CIA NORDESTINA DE PRODS AVIC,507580
08.334.187/0001-71,CIA NORDESTINA DE SUINOCULTURA,508110
06.133.003/0001-80,CIA PAJEU DO MARANHAO-PAJEU,506052
10.804.300/0001-87,CIA PARAIBA CIM PORTL CIMEPAR,3786
12.680.542/0001-31,CIA PARAIBANA DE RAFIA,510440
01.596.401/0001-19,CIA PAULISTA DE ADM DE ATIVOS,16683
57.484.495/0001-99,CIA PAULISTA DE LAMINACAO,3832
61.015.582/0001-74,CIA PAULISTA ENERGIA ELETRICA,3794
61.087.912/0001-37,CIA PAULISTA FERTILIZANTES,3816
09.928.771/0001-18,CIA PERNAMB DE BORR SINTETICA,501956
09.768.292/0001-81,CIA PERNAMBUCANA DE HOTEIS E TURISMO,518875
00.091.652/0001-89,CIA PESQS RECURSOS MINERAIS,3107
07.621.931/0001-56,CIA PESQUEIRA SAO RAIMUNDO,506931
02.854.397/0001-04,CIA PETROLIFERA MARLIM,18899
06.731.046/0001-67,CIA PIAUIENSE AGROINDL,503509
04.172.213/0001-51,CIA PIRATININGA DE FORÇA E LUZ,19275
15.213.374/0001-62,CIA PNEUS TROPICAL,3867
39.826.482/0001-79,CIA PORTUARIA VILA VELHA,517518
10.648.749/0001-01,CIA PRODS AGROPECUARIOS-COPA,519057
07.648.637/0001-38,CIA PRODUTORA DE ALGODÃO E SUINOS - COPAS,508411
11.675.808/0001-95,CIA PRODUTORA DE SUINOS,500780
58.143.967/0001-02,CIA PRODUTORES ARMS GERAIS,2631
10.777.480/0001-55,CIA PRODUTOS CONFIANÇA,517704
33.000.035/0001-80,CIA PROGRESSO INDUSTRIAL BRASIL FABRICA BANGU,3875
04.200.649/0001-07,CIA PROVINCIA DE SECURITIZAÇÃO,19429
15.111.198/0001-58,CIA QUIM DO RECONCAVO,506427
13.837.489/0001-00,CIA QUIMICA METACRIL,3883
13.018.957/0001-07,CIA RIO DAS PEDRAS,505242
92.691.120/0001-09,CIA RIOGRANDENSE DE ADUBOS,3905
92.802.784/0001-90,CIA RIOGRANDENSE DE SANEAMENTO,16748
92.794.486/0001-03,CIA RIOGRANDENSE TELECOMUNICAÇÕES,3913
33.035.759/0001-69,CIA SALINAS PERYNAS,3930
43.776.517/0001-80,CIA SANEAMENTO BÁSICO ESTADO SÃO PAULO,14443
61.360.434/0001-97,CIA SANTISTA DE PAPEL,3948
12.556.957/0001-06,CIA SAO FRANCISCO DO SALGADOR,504998
15.144.017/0001-90,CIA SEGUROS ALIANCA BAHIA,3115
60.405.925/0001-44,CIA SEGUROS AMER SUL YASUDA,3123
15.104.490/0001-43,CIA SEGUROS BAHIA,3131
17.197.385/0001-21,CIA SEGUROS MINAS BRASIL,3140
33.432.139/0001-63,CIA SEGUROS RIO BRANCO,12475
33.158.031/0001-24,CIA SERVICOS ENGA SERVIENGE,3956
12.287.314/0001-04,CIA SID ALAGOAS COMESA,3999
10.806.057/0001-36,CIA SID NORDESTE,4014
20.141.321/0001-13,CIA SID PAINS,4049
04.561.023/0001-26,CIA SIDERURGICA AMAZONIA,3972
07.919.053/0001-50,CIA SIDERURGICA DO PARA - COSIPAR,510238
61.045.381/0001-10,CIA SIDERURGICA MOGI CRUZES,4006
33.042.730/0001-04,CIA SIDERURGICA NACIONAL,4030
22.016.026/0001-60,CIA SIDERURGICA VALE PINDARE,515906
12.926.101/0001-77,CIA STO ANTONIO DO GUAJU,508403
09.256.116/0001-60,CIA SULAMERICANA DE BRINQUEDOS,503576
33.000.076/0001-76,CIA T JANER COM IND,4073
22.677.520/0001-76,CIA TECIDOS NORTE DE MINAS - COTEMINAS,3158
21.255.567/0001-89,CIA TECIDOS SANTANENSE,4081
60.830.833/0001-01,CIA TECNICA DE ENGENHARIA ELETRIC A,18422
57.486.177/0001-67,CIA TELEF BORDA DO CAMPO,4103
92.195.189/0001-33,CIA TELEF MELHOR RESIST,4090
33.460.809/0001-55,CIA TELEFONES DO RJ CETEL,3166
01.447.243/0001-35,CIA TERRAS BONSUCESSO,15830
05.389.812/0001-94,CIA TEXTIL CASTANHAL,4120
09.570.649/0001-12,CIA TEXTIL PE DA SERRA,511013
21.842.729/0001-85,CIA TEXTIL PIRAPORA,502197
01.540.533/0001-29,CIA THERMAS RIO QUENTE,4154
13.432.810/0001-69,CIA TRANSAMERICA DE H NORDESTE,504696
04.382.818/0001-77,CIA TROPICAL DE HOT DA AM,510254
15.147.499/0001-31,CIA TROPICAL DE HOTEIS SA,510505
08.664.088/0001-58,CIA TROPICAL HOTEL TAMBAU,511579
92.682.038/0001-00,CIA UNIAO SEGUROS GERAIS,4162
08.520.512/0001-90,CIA VALE DA CAICARA,501450
05.498.027/0001-70,CIA VALE DO BURITI,501565
06.132.807/0001-64,CIA VALE DO ITAPECURU-CONVALE,517747
14.082.754/0001-42,CIA VALE DO MOJUZINHO,507253
24.146.482/0001-50,CIA VALE DO PRATUDINHO,510041
06.767.693/0001-29,CIA VALE DO RIO DOURADO,503398
10.468.296/0001-23,CIA VALE DO RIO GRANDE,505609
10.468.296/0001-23,CIA VALE DO RIO GRANDE,520160
13.354.980/0001-72,CIA VERAS DE HOTEIS E TURISMO,519677
08.805.517/0001-60,CIA VEREDAS DO RIO PRETO,504378
92.690.643/0001-22,CIA VINICOLA RIO GRANDENSE,4197
84.684.950/0001-72,CIA WETZEL INDL,4200
33.069.766/0001-81,CIA. BRAS PETRÓLEO IPIRANGA,2860
10.919.934/0001-85,CIA. DE CIMENTOS DO BRASIL,2984
76.484.013/0001-45,CIA. DE SANEAMENTO DO PARANÁ - SANEPAR,18627
33.938.119/0001-69,CIA. DISTRIB. DE GÁS DO RIO DE JANEIRO,16616
76.255.926/0001-90,CIA. IGUAÇU DE CAFÉ SOLÚVEL,3336
30.545.324/0001-76,CIA. SECURITIZADORA DE CRÉDITOS FINANCEIROS VERT-RECARGAPAY,25216
03.143.955/0001-96,CIAGRA CIA AGROPAST ARUANÃ,511170
04.651.154/0001-02,CIAGRO CIA INDL DE RORAIMA,512125
09.114.851/0001-30,CIANE CIA DE PROD QUIM DO NE,515949
04.933.446/0001-20,CIAPESC-CIA AMAZONICA DE PESCA,501107
12.298.949/0001-07,CIASA-CAJU INDL ALAGOAS S.A.,518719
39.320.304/0001-71,CIBASA CITRUS BARRA SECA S. A.,515400
02.105.040/0001-23,CIBRASEC CIA BRASILEIRA DE SECURITIZAÇÃO,18287
07.790.264/0001-35,CIC SA,503568
50.930.098/0001-54,CICA SA,3417
91.623.892/0001-32,CICADE CURTUME SA,13234
10.790.616/0001-67,CICANORTE IND DE CONS ALIM SA,7021
04.203.402/0001-44,CICRIA CIA CRIADORA AM,506494
10.343.705/0001-65,CID - CIA INDUSTRIAL DE DOCES,508942
01.102.817/0001-33,CIDADELA TRUST RECEBIVEIS SA,15571
01.027.058/0001-91,CIELO S.A.,21733
12.134.896/0001-80,CIFITEX-CIA INDL FIOS TEXTEIS,506818
07.368.277/0001-10,CIGLA - CIA. INDUSTRIAL GALLETTI DE LAMINADOS,502219
06.882.260/0001-14,CIGRA CIA VALE GRAJAU PAST IND,504890
15.115.520/0001-17,CIMBA SA INDUSTRIA E COMERCIO,4235
27.190.966/0001-95,CIMEF METALURGIA SA,516465
15.847.775/0001-74,CIMENTO ARATU SA,4243
17.283.599/0001-10,CIMENTO CAUE SA,4251
03.372.786/0001-66,CIMENTO ITAU DE CORUMBA SA,4260
33.815.580/0001-24,CIMENTO MAUA SA,13609
03.478.054/0001-55,CIMENTO PORTLAND M GROSSO SA,4278
08.567.539/0001-39,CIMENTO POTY DA PB SA,501735
49.870.397/0001-61,CIMENTO SANTA RITA SA,4286
00.065.557/0001-00,CIMENTO TOCANTINS SA,4294
33.039.223/0001-11,CIMENTO TUPI SA,4308
33.039.223/0001-11,CIMENTO TUPI SA,22829
17.379.827/0001-50,CIMETAL SIDERURGIA SA - EM LIQUIDAÇÃO,4324
60.869.336/0001-17,CIMINAS CIMENTO NAC MINAS SA,11908
34.177.279/0001-03,CIMOB PARTICIPAÇÕES SA,6513
00.272.185/0001-93,CIMS SA,14818
11.027.133/0001-78,CINAP COM IND NOR ART PAPEL SA,509345
14.126.270/0001-58,CINDERELA AGROPEC SA,508675
07.437.016/0001-05,CINESYSTEM S.A.,23965
07.126.899/0001-32,CIPA CIA INDL PRODS ALIM,4332
04.704.557/0001-64,CIPAC - CIA PARA DE ART DE CON,515329
82.166.711/0001-03,CIPLA SA,13900
08.665.978/0001-84,CIPO AGROPECUARIA SA CAPESA,512443
22.975.205/0001-25,CIPRASA - CIPRANDI MADEIRA SA,516295
15.106.693/0001-79,CIQUINE CIA INDS QUIMS DO NE,4340
84.043.009/0001-70,CIRCULO S/A,7056
08.219.396/0001-74,CIRNE CIA INDL DO RN,509760
03.788.718/0001-82,CISA CIA DE SERVICOS AGRICOLAS,512249
12.983.995/0001-37,CISA CONFECCS INDS SA,505870
06.063.390/0001-25,CIT - CIA INDL TECNICA,511242
04.871.372/0001-44,CITAG CIA TOCANTINS AGROINDL,508225
31.918.584/0001-02,CITI CP MERCANTIL SA,16721
34.112.128/0001-69,CITIBANK LEASING S.A. - ARREND.MERCANTIL,4383
34.112.128/0001-69,CITIBANK LEASING S.A. - ARREND.MERCANTIL,21270
60.867.843/0001-11,CITROBRASIL SA,4391
24.956.666/0001-86,CLARION S/A AGROINDUSTRIAL,18490
24.956.666/0001-86,CLARION S/A AGROINDUSTRIAL,513806
