CNPJ,EMPRESA,CODIGO
08.773.135/0001-00,2W ENERGIA S.A.,25224
11.396.633/0001-87,3A COMPANHIA SECURITIZADORA,21954
12.091.809/0001-55,3R PETROLEUM OLÉO E GÁS S.A.,25291
01.547.749/0001-16,521 PARTICIPAÇOES S.A. - EM LIQUIDAÇÃO EXTRAJUDICIAL,16330
01.851.771/0001-55,524 PARTICIPAÇOES SA,16284
01.919.008/0001-19,525 PARTICIPAÇOES SA,16349
31.694.680/0001-14,A C M AGRICOLA SA,505480
08.690.448/0001-96,A G HOTEIS E TURISMO SA,502316
92.659.614/0001-06,A J RENNER SA IND E PARTIP,35
04.895.165/0001-20,A M FIDALGO SA MAT DE CONSTR,504076
06.932.909/0001-64,A O GASPAR INDS SA,503592
02.288.752/0001-25,A.P. PARTICIPAÇOES SA,16802
21.649.280/0001-33,ABC DADOS E INFORMATICA SA,13307
02.258.274/0001-00,ABC SUPERMERCADOS SA,16934
42.275.727/0001-21,ABC XTAL MICROELETRONICA SA,13005
34.033.779/0001-63,ABN AMRO ARRENDAMENTO MERCANTIL SA,15270
44.597.052/0001-62,ABRIL SA,14370
07.794.351/0001-60,ABYARA PLANEJAMENTO IMOBILIÁRIO S/A,20206
10.416.907/0001-90,ACACIA EMPREEND HOTELEIROS SA,501832
09.557.372/0001-98,ACARY HOTELARIA S/A,503908
12.293.130/0001-49,ACOFORTE MOVEIS E EQUIP SA,513911
18.451.005/0001-04,ACOPALMA CIA INDL ACOS V PALMA,60
14.038.517/0001-84,ACORRICO SA IND E COM,505315
61.150.660/0001-43,ACOS ANHANGUERA SA,78
60.890.688/0001-54,ACOS DO BRASIL SA IND E COM,86
92.767.409/0001-56,AÇOS FINOS PIRATINI S/A,14508
60.852.316/0001-33,ACOS IPANEMA (VILLARES) SA,10715
60.664.810/0001-74,AÇOS VILLARES SA,108
42.581.520/0001-85,ACQUA SA AQUICULTURA,518425
39.303.847/0001-80,ACQUAMANIA MULTIPLO LAZER S/A,515230
13.546.353/0001-33,ACRINOR ACRILONITRILA DO NE SA,116
07.825.881/0001-29,ACRUX SECURITIZADORA S/A,20230
02.808.627/0001-07,ACTORI PARTICIPAÇÕES SA,18040
47.080.619/0001-17,AÇUCAR GUARANI S/A,20940
09.811.654/0001-70,ACUMULADORES MOURA SA,502944
28.392.009/0001-04,ADCART INDUSTRIAL S. A.,515574
39.791.330/0001-88,ADCART PRODUTOS ADESIVOS S A..,515604
43.631.183/0001-56,ADEPAR ASSESSORIA ADM SERV SA,7625
11.029.808/0001-18,ADESENE ADESIVOS NO NORDESTE SA,132
11.059.144/0001-30,ADESIVA SA IND DE EMBALAGENS,502162
10.521.581/0001-60,ADUBOS FERTIBOM SA,513148
17.157.215/0001-13,ADUBOS VIANNA SA INDUSTRIA E COMERCIO,159
10.345.009/0001-98,ADVANCED DIGITAL HEALTH MEDICINA PREVENTIVA S.A.,21725
08.827.501/0001-58,AEGEA SANEAMENTO E PARTICIPAÇÕES S.A.,23396
12.528.708/0001-07,AERIS IND. E COM. DE EQUIP. PARA GER. DE ENG. S.A.,25283
33.037.169/0001-75,AEROFOTO CRUZEIRO SA,167
01.917.705/0001-30,AES ELPA SA,19313
04.128.563/0001-10,AES TIETÊ ENERGIA S.A,18970
02.998.609/0001-27,AES TIETE SA,18350
07.798.325/0001-00,AESA AGROPEC EQUATORIAL SA,513962
07.798.325/0001-00,AESA AGROPEC EQUATORIAL SA,520985
02.808.481/0001-91,AETATIS SECURITIZADORA S.A.,18104
10.324.085/0001-17,AFAL S/A IND E COM PRODS METAL,508349
08.326.274/0001-87,AFASA-AGUA FRIA AGROPEC SA,505900
07.620.094/0001-40,AFLUENTE GERAÇÃO DE ENERGIA ELÉTRICA S.A.,20150
10.338.320/0001-00,AFLUENTE TRANSMISSÃO DE ENERGIA ELETRICA S/A,22179
10.869.998/0001-19,AGANOR GASES E EQUIPAMENTOS SA,513466
61.573.796/0001-66,AGF BRASIL SEGUROS SA,12343
33.058.793/0001-59,AGGS INDS GRAFICAS SA,175
61.442.752/0001-05,AGIP DISTRIBUIDORA SA,3921
24.111.809/0001-59,AGIR AGRESTE INDL DE RAFIA SA,517070
07.468.069/0001-93,AGISA AGROPAST E INDL SA,510580
06.722.441/0001-83,AGNORD IND C CONF AGUIA NE SA,503487
07.698.047/0001-10,AGRA EMPREENDIMENTOS IMOBILIÁRIOS S/A,20664
88.610.324/0001-92,AGRALE SA,183
11.040.082/0001-14,AGRE EMPREENDIMENTOS IMOBILIÁRIOS SA,21911
08.943.312/0001-40,AGRENCO LIMITED,80080
63.235.436/0001-80,AGRICOLA BEBEDOURO SA,515221
13.719.224/0001-08,AGRICOLA BEIRA RIO SA,500720
04.335.238/0001-29,AGRICOLA MISTA MARAJOARA SA - AGRIMAR,518921
15.144.603/0001-34,AGRICOLA NOVO HORIZONTE SA,512095
09.319.567/0001-08,AGRICOLA VALE DO MANGEREBA SA,507032
41.153.636/0001-50,AGRICOLA VALE DO MENDONCA SA,516554
27.751.452/0001-61,AGRÍCOLA VALE VERDE SA,507407
27.751.452/0001-61,AGRÍCOLA VALE VERDE SA,519871
22.974.380/0001-06,AGRICULTURA MECANIZADA S/A,511005
88.070.990/0001-85,AGRILEASING SA ARREND MERC,191
04.986.857/0001-83,AGRIMISA AGROPEC IND MIN PA SA,507008
21.356.787/0001-07,AGRINCO-AGROPEC,IND E COM SA,510076
07.467.822/0001-26,AGRIPEC QUIM E FARMAC,501808
05.763.669/0001-59,AGRO AGRI RONDONIA SA,503460
04.523.403/0001-76,AGRO IND JURUPARI ACRE SA,504548
04.167.904/0001-67,AGRO INDL ITAPIRANGA SA,517216
07.561.855/0001-30,AGRO INDL JAGUARUANA SA,509949
13.642.699/0001-35,AGRO INDÚSTRIAS DO VALE SÃO FRANCISCO S/A,516147
34.738.393/0001-57,AGRO MECANIZ AGRI RONDONIA SA,509264
09.273.145/0001-30,AGRO MERCANTIL URTIGAS SA AMUSA,520357
09.242.066/0001-62,AGRO PASTORIL ANGICOS S. A....,515663
09.378.563/0001-92,AGRO PASTORIL CARIRI SA CARIRISA,205
05.149.737/0001-94,AGRO UNA AGRICOLA CURUA UNA S/A,509825
05.750.765/0001-62,AGROALEGRE AGROINDUSTRIAL E PASTORIL MONTE ALEGRE SA,504980
07.066.491/0001-12,AGROBALSAS EMPREEND INDS E AGROPEC SA,519979
04.657.227/0001-65,AGROBRAGANTINA SA,518379
24.380.727/0001-00,AGROBRAS AGRIC TROP DO BR SA,516244
04.255.592/0001-43,AGROBUFALO SA,511773
04.255.592/0001-43,AGROBUFALO SA,520241
03.101.169/0001-26,AGROCISA-AGROPEC COM E IND SA,512613
03.101.169/0001-26,AGROCISA-AGROPEC COM E IND SA,520624
32.477.002/0001-62,AGROCUNHA SA,507806
23.461.411/0001-80,AGROIND BAQUIT SA,512664
23.461.411/0001-80,AGROIND BAQUIT SA,520420
04.792.719/0001-63,AGROINDL BAMA SA,511366
63.791.461/0001-40,AGROINDL BARÃO DO MELGAÇO SA,516317
08.987.190/0001-94,AGROINDL BARRO BRANCO SA,505749
10.775.997/0001-05,AGROINDL CAIANA SA,501085
15.950.058/0001-73,AGROINDL ESTRELA SA,510530
08.983.322/0001-00,AGROINDL IRMAOS ALMEIDA SA,503614
05.594.288/0001-93,AGROINDL LUIZ GUIMARAES SA,511820
04.183.513/0001-36,AGROINDL MANACAPURU SA,513261
24.272.999/0001-96,AGROINDL R. FUNDO SA-AGRISA,509892
05.220.132/0001-42,AGROINDL SA AGROISA,510564
03.164.753/0001-20,AGROINDL SAO PAULO SA,505226
24.422.719/0001-89,AGROINDL SERRA DAS VARAS SA,513997
12.627.758/0001-33,AGROINDL STA LUZIA SA,511927
04.071.676/0001-27,AGROINDL SUINORTE SA,511153
12.765.541/0001-90,AGROINDL TRAVESSIA SA,507903
00.922.144/0001-03,AGROINDUSTRIAL DE CEREAIS DONA CAROLINA S/A,518085
00.082.253/0001-51,AGROINDUSTRIAL DE CEREAIS VERDES CAMPOS S.A.,519715
02.855.176/0001-50,AGROINDUSTRIAL E PASTORIL NATIVA S.A.,519847
15.282.791/0001-67,AGROINDUSTRIAL PALMASA S/A,511277
15.282.791/0001-67,AGROINDUSTRIAL PALMASA S/A,519472
02.680.715/0001-68,AGROINDUSTRIAL SAPUCAIA S/A,518859
06.846.992/0001-59,AGROINDUSTRIAL SERRA VERMELHA S/A,504190
06.846.992/0001-59,AGROINDUSTRIAL SERRA VERMELHA S/A,520306
22.949.390/0001-83,AGROINDUSTRIAL UNIDOS S/A,512770
04.986.188/0001-40,AGROINDUSTRIAL VERA CRUZ S/A,511404
06.403.174/0001-81,AGROISA-AGROINDL CAMPO NOVO SA,501581
12.313.151/0001-89,AGROJAISA AGROPEC JATAHY INDL,514500
22.957.963/0001-10,AGROLANDIA ACAILANDIA IND SA,501395
07.481.559/0001-20,AGROLUPE-AGROPEC GUADALUPE SA,501786
05.753.116/0001-15,AGROLUSA-AGROINDL LUSITANA SA,500496
06.272.470/0001-90,AGROMA EMPREEND RURAIS SA,506036
06.777.965/0001-71,AGROMALTA AGROP MARANHENSE SA,503681
01.355.296/0001-26,AGROMON SA AGRICULTURA E PEC,509329
06.040.547/0001-05,AGROMOSA AGROP M F OLIVEIRA SA,503800
07.025.125/0001-15,AGROMUNDO AGROPEC RAIM VIA SA,505846
00.319.137/0001-03,AGRON AGROINDL SA,507164
04.794.962/0001-10,AGRONESA-AGROPEC NOVA ESPERANÇA,507105
21.444.765/0001-90,AGRONORTE SA,221
06.454.276/0001-26,AGRONOSA AGROPEC NORTE SA,519111
04.102.265/0001-51,AGROPALMA SA,501166
34.130.039/0001-45,AGROPARANÁ S/A,515078
13.632.344/0001-65,AGROPASA AGR MED PARAGUASSU SA,512257
06.011.779/0001-27,AGROPASTORIL CANTANHEDE SA,510173
07.680.093/0001-91,AGROPASTORIL DOIS ACUDES S/A,505102
02.007.196/0001-71,AGROPASTORIL ESTRELA DO ORIENTE SA,518697
07.093.305/0001-34,AGROPASTORIL GADO BRANCO SA,514462
08.818.981/0001-90,AGROPASTORIL GALDINO SA,501751
23.434.400/0001-00,AGROPASTORIL IPUIRU SA,506664
04.365.615/0001-72,AGROPASTORIL JAFFARABAD SA,512966
08.317.364/0001-01,AGROPASTORIL JOSE IVO SA,505323
08.993.933/0001-39,AGROPASTORIL LAGOA DE CIMA S/A - LACIMA,501271
05.512.116/0001-23,AGROPASTORIL LIVRAMENTO SA,506184
04.856.522/0001-40,AGROPASTORIL MURRAH S/A - AGROMURRAH,507261
04.705.570/0001-38,AGROPASTORIL RIO CUNANY SA,509400
43.126.184/0001-43,AGROPASTORIL RODA VELHA SA,504017
25.129.453/0001-43,AGROPASTORIL SANGUINETTE SA AGROSAN,519561
11.539.392/0001-88,AGROPASTORIL SERRA DA EMA SA,507873
11.539.392/0001-88,AGROPASTORIL SERRA DA EMA SA,519162
09.597.170/0001-70,AGROPEC AGUA BRANCA SA,504084
05.363.767/0001-07,AGROPEC ALTEROSA SA,512567
05.363.767/0001-07,AGROPEC ALTEROSA SA,520870
04.599.353/0001-00,AGROPEC AMAMBAI SA,504602
09.569.724/0001-25,AGROPEC ANGELUS SA,503371
04.697.033/0001-93,AGROPEC AQUARIUS SA,519030
04.407.979/0001-78,AGROPEC ARUANA SA,505188
04.851.523/0001-00,AGROPEC BAIXO AMAZONAS SA,517763
05.426.804/0001-70,AGROPEC BARRA DAS PRINCESAS SA,509647
04.987.376/0001-92,AGROPEC BEBEDOURO SA,506966
21.363.270/0001-37,AGROPEC BELA VISTA SA,502286
04.022.489/0001-53,AGROPEC BELO HORIZONTE SA,508799
11.527.439/0001-93,AGROPEC BELO VALE SA,506524
21.706.502/0001-02,AGROPEC BETANIA SA,503967
12.791.281/0001-27,AGROPEC BOA ESPERANCA SA,511781
04.880.829/0001-87,AGROPEC BOA SORTE SA,507890
13.951.272/0001-19,AGROPEC BOA VISTA SA,506648
31.690.746/0001-06,AGROPEC BOA VISTA SA,506745
13.951.272/0001-19,AGROPEC BOA VISTA SA,520497
31.499.015/0001-70,AGROPEC BONOMO SA,508608
31.499.015/0001-70,AGROPEC BONOMO SA,520489
08.021.867/0001-35,AGROPEC BRITO IRMAOS SA,502952
04.818.803/0001-09,AGROPEC CAJABI SA,514381
12.799.904/0001-08,AGROPEC CAMBOA SA,511374
11.523.610/0001-96,AGROPEC CAMPO ALEGRE SA,510327
08.668.238/0001-00,AGROPEC CAMPOS SA,506591
09.192.642/0001-04,AGROPEC CANAFISTULA SA,509272
11.848.025/0001-66,AGROPEC CAROCA SA,506222
04.132.437/0001-30,AGROPEC CAROPA SA,510661
04.132.437/0001-30,AGROPEC CAROPA SA,519430
07.127.053/0001-17,AGROPEC CASCAVEL SA - AGROCASA,509868
08.896.839/0001-61,AGROPEC CAXIRIMBU SA,500372
10.767.341/0001-40,AGROPEC CEARENSE SA - ACESA,515116
17.438.920/0001-99,AGROPEC CEDROMINAS SA,513210
14.714.653/0001-47,AGROPEC CORACI PARANA SA,513717
04.418.398/0001-31,AGROPEC CORUMBIARA SA,513180
12.907.572/0001-38,AGROPEC CUPISSURA SA,516821
13.027.644/0001-15,AGROPEC DA BARRA SA,505811
14.056.386/0001-68,AGROPEC DA STA CRUZ SA,508284
14.056.386/0001-68,AGROPEC DA STA CRUZ SA,519669
04.376.224/0001-53,AGROPEC DEMETRIO SA,507091
04.376.224/0001-53,AGROPEC DEMETRIO SA,520705
06.645.196/0001-58,AGROPEC DIAMANTE SA - AGRODISA,503088
04.713.087/0001-03,AGROPEC DO BOSQUE SA,512699
03.208.360/0001-71,AGROPEC DO CACHIMBO SA,512850
14.123.228/0001-83,AGROPEC DO GUAMA SA,507016
09.574.971/0001-10,AGROPEC DO RETIRO SA,502715
07.363.351/0001-06,AGROPEC DUPLO T SA,520152
06.976.187/0001-40,AGROPEC E INDL MACHADO SA-AGRIMA,520667
06.997.449/0001-52,AGROPEC E INDL SANTANA SA,515817
31.741.259/0001-17,AGROPEC ESTRELA DO NORTE SA,511854
24.067.092/0001-95,AGROPEC ESTRELA SA,511293
11.642.808/0001-99,AGROPEC FAZ CATALUNHA SA,501603
10.246.999/0001-07,AGROPEC FAZ PARANA SA,502774
09.260.597/0001-88,AGROPEC FAZ PAU LEITE SA,503916
08.846.271/0001-74,AGROPEC FERNANDES SA,513512
09.493.404/0001-39,AGROPEC FERREIRA SA,503061
14.035.257/0001-93,AGROPEC FLECHAL SA,513296
14.035.257/0001-93,AGROPEC FLECHAL SA,520055
04.602.181/0001-87,AGROPEC FORQUILHA SA,509809
84.192.079/0001-90,AGROPEC FRANGO ACU SA,516481
11.439.577/0001-10,AGROPEC GERSON MARANHAO SA,511730
06.016.364/0001-46,AGROPEC GIFONI SALES SA,517097
15.053.267/0001-14,AGROPEC GRENDENE SA,500941
04.871.760/0001-25,AGROPEC HAKONE SA,511935
04.696.894/0001-57,AGROPEC ILHA DE NAZARE SA,517313
04.597.316/0001-63,AGROPEC INDEPENDENCIA SA,514268
55.742.977/0001-76,AGROPEC ITAMBE SA,510670
28.477.313/0001-54,AGROPEC ITAPEMIRIM SA,509701
35.098.573/0001-84,AGROPEC ITAPIRACO SA,510696
06.881.361/0001-70,AGROPEC JATOBA SA,510297
05.428.222/0001-23,AGROPEC JATOBA SA,517429
07.223.092/0001-18,AGROPEC JENIPAPO SA,516910
19.388.727/0001-16,AGROPEC LAGOA VERDE SA,517801
22.677.009/0001-74,AGROPEC LOPES SA,508098
11.739.349/0001-66,AGROPEC MALACACHETA SA,505625
04.657.193/0001-09,AGROPEC MARACAJA SA,511897
11.494.804/0001-00,AGROPEC MARFIM SA,503029
08.332.413/0001-85,AGROPEC MARIA PAZ NORTE SA,503118
17.562.893/0001-61,AGROPEC MONTE REI SA,509469
08.632.515/0001-16,AGROPEC MUCAMBE SA,501093
06.843.916/0001-90,AGROPEC MUCAMBO SA,506990
05.625.009/0001-01,AGROPEC MUCUBAL SA,507687
14.725.287/0001-21,AGROPEC MUNDO NOVO SA,503525
79.764.619/0001-22,AGROPEC MUSAMAR SA,500933
05.324.843/0001-67,AGROPEC N S DE FATIMA SA,505366
08.845.398/0001-79,AGROPEC NELSON ALMEIDA SA,514080
08.845.398/0001-79,AGROPEC NELSON ALMEIDA SA,519936
05.061.809/0001-47,AGROPEC NOIRUMBA SA,518220
05.017.041/0001-04,AGROPEC NOVA ERA SA,514160
12.770.335/0001-78,AGROPEC NOVA SERTANIA SA,515019
05.374.053/0001-96,AGROPEC NOVO MUNDO SA,512400
05.374.053/0001-96,AGROPEC NOVO MUNDO SA,519600
05.140.512/0001-77,AGROPEC OLINDA SA,512397
08.057.879/0001-10,AGROPEC OLIVEIRA MACIEL SA,502235
01.146.059/0001-55,AGROPEC PALMIRA DO NORTE SA,515132
33.655.911/0001-06,AGROPEC PEIXE BOI SA,511536
04.930.590/0001-02,AGROPEC PIMENTA BUENO SA,513156
05.306.733/0001-72,AGROPEC PINHO SA AGROPINHO,512206
04.882.908/0001-27,AGROPEC PIQUIA SA,518409
05.377.734/0001-08,AGROPEC PITITAL SA,511510
04.730.412/0001-38,AGROPEC PRACUUBA SA,513245
08.121.329/0001-12,AGROPEC QUIXADA SA,507539
08.121.329/0001-12,AGROPEC QUIXADA SA,520810
04.978.466/0001-17,AGROPEC REMANSO ACU SA,511099
05.426.663/0001-96,AGROPEC REUNIDOS PARAENSE SA,512982
09.009.408/0001-07,AGROPEC RIBEIRA DO MOXOTO SA,501760
03.144.078/0001-78,AGROPEC RICA SA,509698
04.581.971/0001-23,AGROPEC RICASTRO SA,503878
05.078.415/0001-00,AGROPEC RIO ARATAU SA,513458
00.100.651/0001-53,AGROPEC RIO BONITO SA,506613
05.153.515/0001-45,AGROPEC RIO CAUAXI SA,503363
15.026.073/0001-20,AGROPEC RIO DARRO SA,511110
04.364.519/0001-00,AGROPEC RIO DAS ANTAS SA,510149
46.991.329/0001-62,AGROPEC RIO DEZOITO SA,511285
22.921.449/0001-25,AGROPEC RIO DO OURO SA,513326
12.091.260/0001-07,AGROPEC RIO MEARIM SA,503258
46.991.311/0001-60,AGROPEC RIO MUDRIRE SA,511943
46.991.311/0001-60,AGROPEC RIO MUDRIRE SA,520438
04.170.783/0001-02,AGROPEC RIO NEGRO SA,515043
00.809.095/0001-99,AGROPEC RIO PIUM SA,506605
31.683.279/0001-89,AGROPEC RIO PRETO SA,511765
05.023.692/0001-07,AGROPEC RIO S JOAO SA,510408
06.838.940/0001-30,AGROPEC RIO VOLTA SA,504661
05.609.086/0001-78,AGROPEC RODRIGUES DO SANTOS SA,511994
03.144.060/0001-76,AGROPEC RONCADOR SA,505196
04.870.838/0001-97,AGROPEC SALES OLIVEIRA SA,507911
15.611.809/0001-27,AGROPEC SALGADO SA,500747
35.098.532/0001-98,AGROPEC SANTANA SA,510718
08.947.475/0001-00,AGROPEC SAO BOA VENTURA SA,509795
08.187.874/0001-01,AGROPEC SAO CAMILO SA,503673
04.862.744/0001-76,AGROPEC SAO JOAO SA,519910
00.956.532/0001-05,AGROPEC SAO NICOLAU SA,508489
00.085.902/0001-78,AGROPEC SAO PEDRO SA,508063
00.085.902/0001-78,AGROPEC SAO PEDRO SA,520446
46.991.295/0001-06,AGROPEC SAO ROBERTO SA,508080
12.924.601/0001-70,AGROPEC SEMPRE VERDE SA,514055
00.999.987/0001-08,AGROPEC SONHO DOURADO SA,508683
04.595.104/0001-47,AGROPEC STA ADELIA SA,509434
19.324.029/0001-57,AGROPEC STA IDÁLIA - AGROSANTA,506214
24.067.076/0001-00,AGROPEC STA INEZ SA,516392
08.799.512/0001-71,AGROPEC STA IZABEL SA-AGROSISA,501174
07.460.710/0001-43,AGROPEC STA MARTA SA,505935
04.870.226/0001-02,AGROPEC STA RITA DO MARAJO SA,512524
04.870.226/0001-02,AGROPEC STA RITA DO MARAJO SA,520101
12.771.408/0001-46,AGROPEC STA ROSA SA,511382
09.030.081/0001-47,AGROPEC STA TEREZA SA,509396
00.817.627/0001-30,AGROPEC STO ANTONIO DAS LENDAS SA,519219
11.567.708/0001-45,AGROPEC TAMARINDO SA,500631
08.674.160/0001-28,AGROPEC TAMBORIL VITORIA SA,501999
03.481.074/0001-85,AGROPEC TAPIRAPE SA,507245
10.647.972/0001-26,AGROPEC TAQUARY SA,504041
03.288.537/0001-97,AGROPEC TERRA FERTIL SA,505005
00.242.784/0001-64,AGROPEC TERRA GOYANA SA,512044
00.971.838/0001-22,AGROPEC TERRA KIKUIO SA,512036
15.741.192/0001-64,AGROPEC TERRA NOVA SA,508950
06.948.913/0001-10,AGROPEC THOME AFONSO SA,503401
04.334.488/0001-44,AGROPEC TUCUMAN SA,520519
14.114.425/0001-36,AGROPEC VALE DO RIO URINDEUA,515345
09.229.295/0001-47,AGROPEC VALE DIAMANTE SA,505668
09.229.295/0001-47,AGROPEC VALE DIAMANTE SA,520470
83.307.694/0001-31,AGROPEC VALE DO ARAGUAIA S/A,518387
19.564.517/0001-31,AGROPEC VALE DO COCHA SA,502421
10.169.985/0001-37,AGROPEC VALE DO GURGUEIA SA,506656
10.690.410/0001-65,AGROPEC VALE DO IPOJUCA SA,514950
06.724.876/0001-67,AGROPEC VALE DO PRATA SA,504033
12.091.500/0001-65,AGROPEC VALE DO RIO CORDA SA,503002
16.753.832/0001-19,AGROPEC VALE DO SOL SA,504360
12.819.736/0001-75,AGROPEC VARZEA NOVA SA,508551
22.679.567/0001-79,AGROPEC VARZELANDIA SA - AGROPEVA,517895
12.536.454/0001-60,AGROPEC WALCON SA,511080
02.282.297/0001-50,AGROPECUÁRIA ARAÇATUBA S/A,518824
02.856.863/0001-90,AGROPECUÁRIA BRASIL PALMEIRAS S.A.,519073
00.148.825/0001-58,AGROPECUÁRIA DOIS IRMÃOS S/A,511412
13.025.135/0001-53,AGROPECUÁRIA EMILIO OMENA S/A - AGROMENA,507652
02.893.891/0001-88,AGROPECUÁRIA FIO DE OURO S.A.,519154
04.595.112/0001-93,AGROPECUÁRIA FLOR DO OURO S/A,512672
01.235.081/0001-71,AGROPECUÁRIA FOGLIATELLI S.A.,519642
06.418.040/0001-34,AGROPECUÁRIA JOTA COELHO S/A,509205
19.964.360/0001-31,AGROPECUÁRIA ORIENTE S/A,502707
04.595.195/0001-10,AGROPECUÁRIA PARANAIBA S/A,507296
22.887.129/0001-04,AGROPECUARIA PAU RAINHA S/A,509000
02.671.917/0001-43,AGROPECUÁRIA PINGUIM S.A.,519251
02.642.136/0001-20,AGROPECUÁRIA PONTAL DO PARANAITA S.A.,520080
02.907.052/0001-71,AGROPECUÁRIA RICARDO FRANCO S.A.,519200
04.601.738/0001-65,AGROPECUÁRIA RIO BRILHANTE S/A,509388
02.358.271/0001-49,AGROPECUÁRIA RIO URUARÁ S.A.,519804
05.120.340/0001-70,AGROPECUÁRIA SÃO LUIZ LTDA,506397
15.947.450/0001-63,AGROPECUARIA SÃO SEBASTIÃO DO ARAGUAIA S/A,514691
03.143.716/0001-36,AGROPECUARIA TAMAKAVY SA,213
03.143.716/0001-36,AGROPECUARIA TAMAKAVY SA,520640
02.033.525/0001-59,AGROPECUÁRIA TERRA BRAVIA S/A,518484
15.525.447/0001-51,AGROPECUÁRIA VALE DO RIO ACRE S/A,505277
16.688.384/0001-17,AGROPEMA AGROPEC MADRAS SA,508640
06.938.989/0001-65,AGROPIL AGROPEC P IBIAPABA SA,505382
31.498.009/0001-06,AGROPIPER SA,508659
11.430.550/0001-67,AGROPISA AGROPEC DO PIAUI S/A,503649
05.423.587/0001-65,AGROSETE PEC E IND SA,514012
04.971.057/0001-99,AGROTEP SA AGROPEC,511340
15.255.383/0001-16,AGROVAS AGROPEC VALE DO SUIA SA,518468
17.998.493/0001-01,AGROVERDE SA,501409
12.923.546/0001-01,AGROVERDES AGRICOLA SA,500763
31.495.252/0001-62,AGUA PEDRA AZUL SA,513440
07.638.562/0001-04,AGUA VERDE AGROPEC SA AVASA,507636
15.178.767/0001-82,AGUA VIVA PRAIA HOTEL SA,515876
11.742.087/0001-99,AGUANAMBI INDL SA,506877
27.157.474/0001-06,ÁGUAS DE TERESINA SANEAMENTO SPE S.A.,25615
04.089.570/0001-50,AGUAS GUARIROBA S.A.,23442
10.665.743/0001-34,AGUISA-AGROPEC GUIMARAES SA,502499
10.665.743/0001-34,AGUISA-AGROPEC GUIMARAES SA,520128
09.594.796/0001-22,AGV HOLDING S/A,21806
60.830.296/0001-08,AIR LIQUIDE,9288
17.059.049/0001-12,AJAJ SA AGROPECUARIA,516260
06.019.343/0001-84,AJEFISA-AGROPEC JOSE A F SA,513040
24.479.438/0001-62,ALAISA ALAGOAS AGRIC IRRIG.,515248
02.783.422/0001-06,ALBAE PARTICIPACOES SA,18074
57.912.396/0001-60,ALBATROZ SA,13242
10.867.026/0001-95,ALCACE NE SA EQUIP ELETRICOS,511056
08.240.673/0001-20,ALCALIS RIO GRANDE DO NORTE SA,15067
08.240.673/0001-20,ALCALIS RIO GRANDE DO NORTE SA,510092
60.561.800/0001-03,ALCAN ALUMINIO DO BRASIL SA,256
56.994.791/0001-77,AL-CAR EMPREENDIMENTOS E PARTICIPAÇÕES SA,17957
08.486.375/0001-15,ALCLOR QUIM DE ALAGOAS SA,503320
11.696.820/0001-86,ALCOA ALUMINIO DO NE SA,500402
23.637.697/0001-01,ALCOA ALUMINIO SA,264
39.326.590/0001-82,ALDEIA DOS REIS TURISMO SA,516724
02.217.319/0001-07,ALEF SA,16705
24.278.582/0001-30,ALENAIDE AGRICOLA SA,516139
24.278.582/0001-30,ALENAIDE AGRICOLA SA,519758
17.167.396/0001-69,ALFA HOLDINGS SA,9954
15.167.984/0001-77,ALFA NORDESTE SA INDUSTRIA DO VESTUARIO,272
92.689.173/0001-87,ALFRED SA COMERCIO DO VESTUARIO,280
71.208.516/0001-74,ALGAR TELECOM S/A,21032
63.764.435/0001-22,ALGONORTE ALGODOEIRA NORTE SA,514624
06.082.980/0001-03,ALIANSCE SHOPPING CENTERS S/A,21300
05.878.397/0001-32,ALIANSCE SONAE SHOPPING CENTERS S.A.,22357
12.616.496/0001-01,ALIM PROTEICOS DO NORTE SA,510599
02.997.713/0001-05,ALIMENTA PARTICIPAÇÕES E SERVIÇOS SA,18260
04.133.906/0001-35,ALIMENTICIO INTERN DE CACAU SA,509248
33.826.637/0001-90,ALIPAR ALIMENTOS E PARTS SA,14079
02.783.425/0001-40,ALIUM PARTICIPAÇÕES SA,18082
04.965.794/0001-89,ALL FAMA INDL SA,517321
04.965.794/0001-89,ALL FAMA INDL SA,520225
20.247.322/0001-47,ALLIED TECNOLOGIA S.A.,25330
08.648.295/0001-19,ALLIS PARTICIPAÇÕES S.A.,20850
60.537.263/0001-66,ALLPARK EMPREENDIMENTOS, PARTICIPAÇÕES E SERVIÇOS S.A.,24953
30.965.065/0001-32,ALMASA ALCOOLEIRA MATEENSE SA,507865
09.018.953/0001-51,ALMASA ALIMS DO MA SA,509418
18.012.393/0001-19,ALMEC INDUSTRIAS MECANICA SA,302
07.258.627/0001-96,ALOBA SA AGROINDL DO NE,507709
61.079.117/0001-05,ALPARGATAS SA,10456
47.848.684/0001-40,ALPART ALPA PARTICIPACOES SA,310
11.721.921/0001-60,ALPER CONSULTORIA E CORRETORA DE SEGUROS S.A.,22217
32.477.457/0001-88,ALPES SA HOT E TUR,506672
16.811.931/0001-00,ALPHAVILLE S.A.,25275
87.819.926/0001-91,ALPINA BRASIL SA MAQ IMP AGRIC,329
49.705.528/0001-55,ALPLAN SA IND COM CH MAD AGLOM,337
02.282.923/0001-09,ALTA - AMER.LAT.TELEC.AVANÇADAS S/A,17310
02.783.423/0001-50,ALTERE SECURITIZADORA S.A.,18066
92.859.974/0001-43,ALTUS SISTEMA DE AUTOMAÇÃO S.A.,23183
06.960.645/0001-52,ALUBRAS ARTF ACO ALUM BR SA,504165
04.955.456/0001-66,ALUMAZON COMPONENTES DA AM S A,516090
04.955.456/0001-66,ALUMAZON COMPONENTES DA AM S A,521019
12.569.935/0001-72,ALUMÍNIO EXTRUDADO DO BRASIL S/A,516856
12.569.935/0001-72,ALUMÍNIO EXTRUDADO DO BRASIL S/A,520900
10.886.893/0001-78,ALUMINIO EXTRUSAO LAMINACAO,345
09.037.706/0001-00,ALUMINIO IPAM SA - IND E COM,512303
09.037.706/0001-00,ALUMINIO IPAM SA - IND E COM,519782
13.609.441/0001-37,ALUMINIO TIGRE SA IND E COM.,512281
11.162.096/0001-00,ALUMISA NORDESTE SA,518832
08.364.948/0001-38,ALUPAR INVESTIMENTO S/A,21490
82.998.600/0001-55,ALUSUD ALUMINIO DO SUL SA,353
07.196.934/0001-90,ALVORADA CARTOES, CREDITO, FINANCIAMENTO E INVESTIMENTO S/A,1147
84.151.372/0001-09,ALYA AGROINDUSTRIAL S. A.,515310
39.324.892/0001-11,AM AGROPECUARIA S. A.,515531
96.735.105/0001-68,AMADEO ROSSI SA MET MUNICOES,361
24.170.211/0001-30,AMALFI EMPREENDIMENTOS E PARTICIPAÇÕES S.A.,24503
04.378.352/0001-36,AMAPATIUA AGROPECUARIA S. A...,515361
02.036.227/0001-12,AMARANTE PARTICIPACOES SA,16918
47.959.697/0001-96,AMAZONAS PRODS P CALCADOS SA,370
04.947.867/0001-00,AMAZONEX INDL EXPORTADORA SA,504092
06.352.108/0001-20,AMAZONIA AGROPEC INDL,502049
02.340.278/0001-33,AMAZONIA CELULAR S/A,17280
00.380.153/0001-01,AMAZÔNIA GOLF HOTELARIA E TURISMO S/A,520187
04.566.576/0001-71,AMAZONIA INDL E COML GUARANA,512362
05.057.179/0001-37,AMAZONIA SA INDUSTRIA ALIMENTICIA,517690
07.526.557/0001-00,AMBEV S.A.,23264
12.648.266/0001-24,AMBIPAR PARTICIPAÇÕES E EMPREENDIMENTOS S.A.,24961
84.127.208/0001-66,AMCOR EMBALAGENS DA AMAZONIA S/A,515523
57.009.078/0001-94,AMELCO SA IND ELETRONICA,12750
44.081.677/0001-77,AMERICA DO SUL LEAS SA ARR MER,388
31.805.419/0001-44,AMERICAN TRADING S/A,505250
01.223.522/0001-15,AMERICAS EMPRS ARTISTICOS SA,15679
01.685.903/0001-16,AMERICEL SA,16195
13.025.614/0001-70,AMIDO GLUCOSE SA IND E COM,508241
36.461.242/0001-20,AMIL PARTICIPAÇÕES S/A,21172
33.050.071/0001-58,AMPLA ENERGIA E SERVIÇOS S.A.,3050
07.809.905/0001-56,AMPLA INVESTIMENTOS E SERVIÇOS S/A,20214
40.430.571/0001-80,ANCAR EMPREENDIMENTOS COMERCIAIS S/A,19259
00.979.769/0001-01,ANCAR SHOPPING SA,15326
76.491.661/0001-29,ANCORA COMERCIAL SA,396
60.503.232/0001-94,ANDERSON CLAYTON SA IND E COM,400
03.601.314/0001-38,ANDRADE GUTIERREZ CONCESSOES SA,19437
36.310.076/0001-60,ANDRADE GUTIERREZ GRANITOS SA,514179
04.031.960/0001-70,ANDRADE GUTIERREZ PARTICIPAÇÕES SA,19062
09.015.421/0001-60,ANDRADE LIMA HOTEIS SA,503657
31.751.233/0001-50,ANDRADE SA MARMORES E GRANITOS,506699
09.015.322/0001-89,ANGICAL AGROPEC SA,500275
22.107.296/0001-87,ANGICOS SA AGROPASTORIL,518263
04.310.392/0001-46,ANHANGUERA EDUCACIONAL PARTICIPAÇÕES S.A.,18961
04.582.540/0001-81,ANHUMAS AGROPEC SA,507962
09.288.252/0001-32,ANIMA HOLDING S/A,23248
46.892.592/0001-02,ANSON AGROPEC SA,507458
60.661.451/0001-00,ANSON SA ENG FUND RECUPERACOES,12416
06.560.973/0001-61,APESA AGROPASTORIL PIAUIENSE,503185
05.020.920/0001-95,APIACAS HOTEIS E TUR SA,511846
33.017.088/0001-03,APOLO PRODUTOS DE ACO SA,426
12.536.710/0001-10,APPO SA IND DE CONFECCOES,517003
09.405.671/0001-07,AQUAMARIS AQUACULTURA SA,511706
11.197.023/0001-54,AQUA-RIO S/A,22101
45.169.000/0001-58,AQUATEC QUIMICA SA,12564
09.439.783/0001-89,ÁQUILLA SECURITIZADORA SA,21512
15.914.972/0001-69,AR CAPITAL SECURITIES COMPANHIA SECURITIZADORA S.A.,22950
42.157.511/0001-61,ARACRUZ CELULOSE S/A,434
17.805.110/0001-23,ARAFERTIL SA,485
02.517.787/0001-99,ARAGUAIA CIA INDL DE PROD ALIM,442
02.517.787/0001-99,ARAGUAIA CIA INDL DE PROD ALIM,520179
01.543.362/0001-91,ARAGUAIA SA MIN RACOES FERTIL,13161
76.516.921/0001-73,ARAPUA IMPORTACAO COMERCIO SA,9806
05.680.558/0001-89,ARAPUA NORTE AGROPEC DE EXP,500917
25.122.961/0001-08,ARAPUIM AGROPEC E IND SA,505498
10.169.860/0001-07,ARARIPE TEXTIL SA - ARTESA,508381
15.604.465/0001-29,ARATUR HOT TUR DE ARACAJU SA,501034
04.371.159/0001-73,ARAUAYA AGRICOLA E COML SA,512370
03.616.277/0001-31,ARAUCÁRIA PARTICIPAÇÕES SA,18651
00.237.000/0001-00,ARBRA SA,14788
